{
  "schemaVersion": 1,
  "site": {
    "name": "Bloom & Blade Salon",
    "industry": "salon",
    "locale": "en-IN"
  },
  "theme": {
    "preset": "noir-gold",
    "mode": "dark",
    "color": {
      "primary": "#C9A227",
      "secondary": "#8A6D1F",
      "accent": "#D9B441",
      "bg": "#0D0D0F",
      "surface": "#17171A",
      "text": "#F2EFE9",
      "muted": "#A39C90",
      "border": "#2A2A2E"
    },
    "font": {
      "heading": "Jost",
      "body": "Karla"
    },
    "radius": "md",
    "spacing": "comfortable",
    "container": "normal"
  },
  "nav": {
    "header": [
      {
        "label": "Home",
        "pageId": "home"
      },
      {
        "label": "Services",
        "pageId": "services"
      },
      {
        "label": "Products",
        "pageId": "products"
      },
      {
        "label": "Contact",
        "pageId": "contact"
      }
    ]
  },
  "business": {
    "phone": "+91 86001 29124",
    "whatsapp": "+91 86001 29124",
    "email": "harshpimpalkar@gmail.com",
    "social": {
      "instagram": "https://www.instagram.com/bloom_blade.unsex.salon/",
      "facebook": "https://www.facebook.com/"
    },
    "hours": [
      {
        "day": "mon",
        "open": "08:30 AM",
        "close": "09:30 PM"
      },
      {
        "day": "tue",
        "open": "08:30 AM",
        "close": "09:30 PM"
      },
      {
        "day": "wed",
        "open": "08:30 AM",
        "close": "09:30 PM"
      },
      {
        "day": "thu",
        "open": "08:30 AM",
        "close": "09:30 PM"
      },
      {
        "day": "fri",
        "open": "08:30 AM",
        "close": "09:30 PM"
      },
      {
        "day": "sat",
        "open": "08:30 AM",
        "close": "09:30 PM"
      },
      {
        "day": "sun",
        "open": "08:30 AM",
        "close": "09:30 PM"
      }
    ],
    "address": "Plot No. 27, Shilpa Society, Near Maharaja Tiles, In Front of Londe Jewellers, Beltarodi Road, Nagpur"
  },
  "pages": [
    {
      "id": "home",
      "slug": "/",
      "title": "Home",
      "seo": {
        "title": "Bloom & Blade Unisex Salon | Haircut, Beard, Keratin, Facial & Bridal Makeup",
        "description": "Unisex salon offering haircut, beard, spa, facial, keratin, botox, nanoplastia, wax, clean-up, D-tan, makeup, ironing, tong and crimping, highlights, smoothing and colour. Open 8:30 AM to 9:30 PM. WhatsApp 86001 29124.",
        "robots": "index,follow"
      },
      "sections": [
        {
          "id": "header-1",
          "type": "header",
          "visible": true,
          "props": {
            "sticky": true,
            "showCart": true,
            "showAccount": false,
            "links": [
              {
                "text": "Home",
                "href": "/"
              },
              {
                "text": "Services",
                "href": "/services"
              },
              {
                "text": "Products",
                "href": "/products"
              },
              {
                "text": "Contact",
                "href": "/contact"
              }
            ],
            "cta": {
              "text": "Book on WhatsApp",
              "href": "https://wa.me/918600129124",
              "style": "primary"
            }
          }
        },
        {
          "id": "hero-1",
          "type": "hero",
          "visible": true,
          "variant": "centered-bg",
          "props": {
            "badge": "Unisex Salon · Beltarodi Road, Nagpur",
            "heading": "Style that speaks. Confidence that stays.",
            "sub": "Bloom & Blade is a unisex salon on Beltarodi Road — haircut and beard on one side of the chair, keratin, facial and bridal makeup on the other.\n\nSixteen services, open 8:30 AM to 9:30 PM. Walk in, or message 86001 29124 to book a slot and skip the wait.",
            "image": "https://images.pexels.com/photos/2420280/pexels-photo-2420280.jpeg?auto=compress&cs=tinysrgb&w=1600",
            "fullHeight": true,
            "ctaPrimary": {
              "text": "Book on WhatsApp",
              "href": "https://wa.me/918600129124",
              "style": "primary"
            },
            "ctaSecondary": {
              "text": "See all services",
              "href": "/services",
              "style": "ghost"
            },
            "showWhatsapp": true,
            "showCall": true
          },
          "style": {
            "overlay": 0.58
          }
        },
        {
          "id": "about-1",
          "type": "about",
          "visible": true,
          "variant": "image-right",
          "props": {
            "label": "About Us",
            "heading": "One salon, both sides of the chair",
            "body": "Bloom & Blade is a unisex salon. That is not a detail on the signboard — it changes what we keep in the cabinet and who is behind the chair.\n\nOn the grooming side: haircuts, beard shaping, hair colour, ironing, tong and crimping. On the treatment side: facials, clean-up, D-tan, waxing, hair spa and bridal makeup. And the chemical work that needs real training — keratin, hair botox, nanoplastia and smoothing.\n\nWe use professional lines rather than whatever is cheapest, and we sell the same brands over the counter so the result you leave with can be maintained at home. Ask before you buy — the wrong shampoo will strip a keratin treatment in a fortnight.\n\nOpen from 8:30 in the morning to 9:30 at night, so a haircut before work or a treatment after it are both possible.",
            "image": "https://images.pexels.com/photos/36873730/pexels-photo-36873730.jpeg?auto=compress&cs=tinysrgb&w=1400",
            "showPillars": true,
            "pillars": [
              {
                "icon": "users",
                "title": "Unisex Experts",
                "text": "Both sides of the chair, properly. Grooming and beard work as well as colour, treatments and bridal."
              },
              {
                "icon": "star",
                "title": "Premium Styling",
                "text": "Cuts, styling, ironing, tong and crimping — finished the way you would want to walk out with it."
              },
              {
                "icon": "droplet",
                "title": "Hair Care",
                "text": "Keratin, botox, nanoplastia, smoothing and spa, with the aftercare that decides how long it lasts."
              },
              {
                "icon": "scissors",
                "title": "Beard Grooming",
                "text": "Shaping, trims, line-ups and clean shaves. Fresh blade every customer, opened in front of you."
              }
            ]
          }
        },
        {
          "id": "team-1",
          "type": "team",
          "visible": true,
          "variant": "cards-2",
          "props": {
            "label": "The Owner",
            "heading": "Run by Harshal Pimpalkar",
            "sub": "The number on the card is his. You are dealing with the owner, not a front desk.",
            "items": [
              {
                "name": "Harshal Pimpalkar",
                "role": "Owner",
                "meta": "Bloom & Blade Unisex Salon, Beltarodi Road",
                "bio": "Runs Bloom & Blade day to day and is usually in the salon. If you want to talk through a treatment before booking — whether keratin or nanoplastia suits your hair, what a bridal slot involves, or what something will cost — message 86001 29124 and you are talking to him directly."
              },
              {
                "name": "Style that speaks. Confidence that stays.",
                "role": "How we work",
                "meta": "Unisex · Open 8:30 AM to 9:30 PM",
                "bio": "We would rather tell you a treatment is wrong for your hair than take the booking and have you back in a month unhappy. Chemical services get a condition check first, and every one leaves with aftercare instructions."
              }
            ]
          }
        },
        {
          "id": "services-1",
          "type": "services",
          "visible": true,
          "variant": "cards-3",
          "props": {
            "label": "Services",
            "heading": "What we do",
            "sub": "Sixteen services for men and women. Rates depend on hair length, condition and the products used — message us and we will tell you exactly.",
            "items": [
              {
                "image": "https://images.pexels.com/photos/7781845/pexels-photo-7781845.jpeg?auto=compress&cs=tinysrgb&w=1200",
                "title": "Haircut",
                "desc": "Cuts for men and women — a trim to keep a shape, or a full restyle. Tell us how you usually wear it and how much time you want to spend on it at home.",
                "meta": "Men & women"
              },
              {
                "image": "https://images.pexels.com/photos/36873730/pexels-photo-36873730.jpeg?auto=compress&cs=tinysrgb&w=1200",
                "title": "Beard",
                "desc": "Beard shaping, trims, line-ups and clean shaves. Fresh blade every customer, opened in front of you.",
                "meta": "Shape · Trim · Shave"
              },
              {
                "image": "https://images.pexels.com/photos/2218558/pexels-photo-2218558.jpeg?auto=compress&cs=tinysrgb&w=1200",
                "title": "Make Up",
                "desc": "Party and occasion makeup, and full bridal. Bridal is by appointment — book well ahead in wedding season.",
                "meta": "Party · Bridal · By appointment"
              },
              {
                "image": "https://images.pexels.com/photos/18367697/pexels-photo-18367697.jpeg?auto=compress&cs=tinysrgb&w=1200",
                "title": "Keratin",
                "desc": "Keratin treatment for frizz control and manageability. Comes with aftercare instructions — the shampoo you use afterwards decides how long it lasts.",
                "meta": "Frizz control · Aftercare included"